<?xml version="1.0" encoding="UTF-8"?>
<xsd:schema xmlns:xsd="http://www.w3.org/2001/XMLSchema" xmlns:od="urn:schemas-microsoft-com:officedata">
<xsd:element name="dataroot">
<xsd:complexType>
<xsd:sequence>
<xsd:element ref="Customer_Query" minOccurs="0" maxOccurs="unbounded" />
</xsd:sequence>
<xsd:attribute name="generated" type="xsd:dateTime" />
</xsd:complexType>
</xsd:element>
<xsd:element name="Customer_Query">
<xsd:annotation>
<xsd:appinfo />
</xsd:annotation>
<xsd:complexType>
<xsd:sequence>
<xsd:element name="Customer_ID" minOccurs="0" od:jetType="longinteger" od:sqlSType="int" type="xsd:int" />
<xsd:element name="Customer_Credit_ID" minOccurs="0" od:jetType="longinteger" od:sqlSType="int" type="xsd:int" />
<xsd:element name="Customer_Name" minOccurs="0" od:jetType="text" od:sqlSType="nvarchar">
<xsd:simpleType>
<xsd:restriction base="xsd:string">
<xsd:maxLength value="40" />
</xsd:restriction>
</xsd:simpleType>
</xsd:element>
<xsd:element name="Contact_First_Name" minOccurs="0" od:jetType="text" od:sqlSType="nvarchar">
<xsd:simpleType>
<xsd:restriction base="xsd:string">
<xsd:maxLength value="30" />
</xsd:restriction>
</xsd:simpleType>
</xsd:element>
<xsd:element name="Contact_Last_Name" minOccurs="0" od:jetType="text" od:sqlSType="nvarchar">
<xsd:simpleType>
<xsd:restriction base="xsd:string">
<xsd:maxLength value="30" />
</xsd:restriction>
</xsd:simpleType>
</xsd:element>
<xsd:element name="Contact_Title" minOccurs="0" od:jetType="text" od:sqlSType="nvarchar">
<xsd:simpleType>
<xsd:restriction base="xsd:string">
<xsd:maxLength value="5" />
</xsd:restriction>
</xsd:simpleType>
</xsd:element>
<xsd:element name="Contact_Position" minOccurs="0" od:jetType="text" od:sqlSType="nvarchar">
<xsd:simpleType>
<xsd:restriction base="xsd:string">
<xsd:maxLength value="30" />
</xsd:restriction>
</xsd:simpleType>
</xsd:element>
<xsd:element name="Last_Years_Sales" minOccurs="0" od:jetType="currency" od:sqlSType="money" type="xsd:double" />
<xsd:element name="Address1" minOccurs="0" od:jetType="text" od:sqlSType="nvarchar">
<xsd:simpleType>
<xsd:restriction base="xsd:string">
<xsd:maxLength value="60" />
</xsd:restriction>
</xsd:simpleType>
</xsd:element>
<xsd:element name="Address2" minOccurs="0" od:jetType="text" od:sqlSType="nvarchar">
<xsd:simpleType>
<xsd:restriction base="xsd:string">
<xsd:maxLength value="20" />
</xsd:restriction>
</xsd:simpleType>
</xsd:element>
<xsd:element name="City" minOccurs="0" od:jetType="text" od:sqlSType="nvarchar">
<xsd:simpleType>
<xsd:restriction base="xsd:string">
<xsd:maxLength value="20" />
</xsd:restriction>
</xsd:simpleType>
</xsd:element>
<xsd:element name="Region" minOccurs="0" od:jetType="text" od:sqlSType="nvarchar">
<xsd:simpleType>
<xsd:restriction base="xsd:string">
<xsd:maxLength value="30" />
</xsd:restriction>
</xsd:simpleType>
</xsd:element>
<xsd:element name="Country" minOccurs="0" od:jetType="text" od:sqlSType="nvarchar">
<xsd:simpleType>
<xsd:restriction base="xsd:string">
<xsd:maxLength value="30" />
</xsd:restriction>
</xsd:simpleType>
</xsd:element>
<xsd:element name="Postal_Code" minOccurs="0" od:jetType="text" od:sqlSType="nvarchar">
<xsd:simpleType>
<xsd:restriction base="xsd:string">
<xsd:maxLength value="10" />
</xsd:restriction>
</xsd:simpleType>
</xsd:element>
<xsd:element name="E-mail" minOccurs="0" od:jetType="text" od:sqlSType="nvarchar">
<xsd:simpleType>
<xsd:restriction base="xsd:string">
<xsd:maxLength value="50" />
</xsd:restriction>
</xsd:simpleType>
</xsd:element>
<xsd:element name="Web_Site" minOccurs="0" od:jetType="text" od:sqlSType="nvarchar">
<xsd:simpleType>
<xsd:restriction base="xsd:string">
<xsd:maxLength value="50" />
</xsd:restriction>
</xsd:simpleType>
</xsd:element>
<xsd:element name="Phone" minOccurs="0" od:jetType="text" od:sqlSType="nvarchar">
<xsd:simpleType>
<xsd:restriction base="xsd:string">
<xsd:maxLength value="20" />
</xsd:restriction>
</xsd:simpleType>
</xsd:element>
<xsd:element name="Fax" minOccurs="0" od:jetType="text" od:sqlSType="nvarchar">
<xsd:simpleType>
<xsd:restriction base="xsd:string">
<xsd:maxLength value="20" />
</xsd:restriction>
</xsd:simpleType>
</xsd:element>
</xsd:sequence>
</xsd:complexType>
</xsd:element>
</xsd:schema>